{"$schema":"https://json-schema.org/draft/2020-12/schema","additionalProperties":false,"properties":{"$schema":{"const":"https://json-schema.org/draft/2020-12/schema"},"artifact_status":{"const":"draft"},"calculation":{"const":"length-prefixed-relative-path-and-file-bytes-sha256/v0.1"},"entries":{"items":{"additionalProperties":false,"properties":{"artifact_status":{"enum":["draft","test-only"]},"digest":{"pattern":"^sha256:[0-9a-f]{64}$","type":"string"},"path":{"maxLength":512,"minLength":1,"pattern":"^(?!/)(?!.*\\\\\\\\)(?!.*(?:^|/)\\\\.\\\\.?(?:/|$))[A-Za-z0-9._/-]+$","type":"string"},"role":{"maxLength":512,"minLength":1,"type":"string"}},"required":["path","digest","role","artifact_status"],"type":"object"},"minItems":1,"type":"array"},"license":{"const":"Apache-2.0"},"limitations":{"items":{"maxLength":512,"minLength":1,"type":"string"},"minItems":1,"type":"array"},"review_source":{"maxLength":512,"minLength":1,"type":"string"},"schema_version":{"const":"0.1"},"tree_digest":{"pattern":"^sha256:[0-9a-f]{64}$","type":"string"}},"required":["$schema","schema_version","artifact_status","tree_digest","calculation","entries","review_source","limitations","license"],"type":"object"}