{"$schema":"https://json-schema.org/draft/2020-12/schema","artifact_status":"draft","calculation":"length-prefixed-relative-path-and-file-bytes-sha256/v0.1","entries":[{"artifact_status":"draft","digest":"sha256:ee76a2c31c0dd63e8e76445dfe2627f430becc6d7f7505b39f06512bab9f50a9","path":"conformance/messages/authenticated-requesters.v0.1.yaml","role":"authenticated-requester-registry"},{"artifact_status":"draft","digest":"sha256:355af008d20ea45fb32407d5e1587720acc604840983d999c87e54332641253e","path":"conformance/messages/context.v0.1.yaml","role":"message-validation-context"},{"artifact_status":"test-only","digest":"sha256:1834d9c594770b7b7fbc4291eaa40aff5c46780d77c3d2cbac5b2e891e43a5a6","path":"conformance/messages/expected-digests/vectors.v0.1.json","role":"expected-message-vector"},{"artifact_status":"draft","digest":"sha256:332780d768c375c5829d210c955358f14659dafc853402b96a672a381b2be6f4","path":"conformance/messages/invalid/actual-disclosure-payload.json","role":"invalid-message-fixture-or-manifest"},{"artifact_status":"draft","digest":"sha256:ebc8051ba4af68c0024432a2e54f240e4d399ceb81ccc15fe87467fd50fc8a1b","path":"conformance/messages/invalid/authentication-sender-key-mismatch.json","role":"invalid-message-fixture-or-manifest"},{"artifact_status":"draft","digest":"sha256:67c7666130d40a6ca068f6fe77beae8ccc0bdf2390fe72382a0ae83307ca9425","path":"conformance/messages/invalid/callback-attempt-mismatch.json","role":"invalid-message-fixture-or-manifest"},{"artifact_status":"draft","digest":"sha256:d4513f7487e79555b387d951da983f1e8832a236f01675b321575dc5994f411a","path":"conformance/messages/invalid/callback-profile-mismatch.json","role":"invalid-message-fixture-or-manifest"},{"artifact_status":"draft","digest":"sha256:7e05346c1ef4aeb3b11b20134ed6db5c1ac7988da04893549da0cdd1b28e1b43","path":"conformance/messages/invalid/coordinator-material-for-party.json","role":"invalid-message-fixture-or-manifest"},{"artifact_status":"draft","digest":"sha256:4381b57b075360f01cdf03a8fa92c85525c6eef3f922e90a2f7fb65587663c1e","path":"conformance/messages/invalid/cross-participant-substitution.json","role":"invalid-message-fixture-or-manifest"},{"artifact_status":"draft","digest":"sha256:138788228ae225034339a2e8f64a6e26bfe8bac7375228265feb56bf31694025","path":"conformance/messages/invalid/cross-policy-substitution.json","role":"invalid-message-fixture-or-manifest"},{"artifact_status":"draft","digest":"sha256:ce5e0d808bb3a5883d93da488fca1ad0ccd9b79454ef1876afe4b8b5b7268748","path":"conformance/messages/invalid/cross-session-substitution.json","role":"invalid-message-fixture-or-manifest"},{"artifact_status":"draft","digest":"sha256:0b3072fa28edf1513cf268ae74f02f14b586a00645e26f5e4c392126845fccea","path":"conformance/messages/invalid/duplicate-json-key.json","role":"invalid-message-fixture-or-manifest"},{"artifact_status":"draft","digest":"sha256:de9fdf07ec6283ff8c1eea72b17bd9a1dcf4221580a8dc6209c2a6745c26b7b4","path":"conformance/messages/invalid/expired-message.json","role":"invalid-message-fixture-or-manifest"},{"artifact_status":"draft","digest":"sha256:71cce665fd55147bbd893e2ad5701505cafae3c11f207ee4ecb078e1c4ae824f","path":"conformance/messages/invalid/expired-verification-material.json","role":"invalid-message-fixture-or-manifest"},{"artifact_status":"draft","digest":"sha256:53fb975dca276be34832ba738adf65039ac645a5f30e13b7b6c40018be30d5eb","path":"conformance/messages/invalid/future-issued-at.json","role":"invalid-message-fixture-or-manifest"},{"artifact_status":"draft","digest":"sha256:87dd68eb4154c62369dd6399cc165102fe23582ac923445030e65355d0dea622","path":"conformance/messages/invalid/infinity.json","role":"invalid-message-fixture-or-manifest"},{"artifact_status":"draft","digest":"sha256:75be2cf53d7ee3264600bfdef7ecfa5973dc2aa5f2f943eb87f4290c79bd5974","path":"conformance/messages/invalid/manifest.v0.1.yaml","role":"invalid-message-fixture-or-manifest"},{"artifact_status":"draft","digest":"sha256:1a0da93da13880e9b28ccdd71984386bd9cab6882c3f2ee1fd0817b57035e6ca","path":"conformance/messages/invalid/material-expired-at-authoritative-time.json","role":"invalid-message-fixture-or-manifest"},{"artifact_status":"draft","digest":"sha256:d302d7080a36ad11b7b7fa3de22a2cdcc4176f3b04f5d4eddbc0f2f0cac911b9","path":"conformance/messages/invalid/material-issued-before-not-before.json","role":"invalid-message-fixture-or-manifest"},{"artifact_status":"draft","digest":"sha256:2e2d54e6aa84a4812a380c371c4e62c09304df1154005dbb91487597b98bd093","path":"conformance/messages/invalid/material-participant-mismatch.json","role":"invalid-message-fixture-or-manifest"},{"artifact_status":"draft","digest":"sha256:f1bac308b2440bafbed84a0c0741436ca7efb7b34223e5d3552990b29721088f","path":"conformance/messages/invalid/message-version-mismatch.json","role":"invalid-message-fixture-or-manifest"},{"artifact_status":"draft","digest":"sha256:1d5530355c82f96fffdad4605eb2f2db8ec147a33e9d2c63b82d94c1a9d63453","path":"conformance/messages/invalid/missing-algorithm-id.json","role":"invalid-message-fixture-or-manifest"},{"artifact_status":"draft","digest":"sha256:6acac92104e3e6625484340f68b2714855f28ba5d537f2503d91772e41c365af","path":"conformance/messages/invalid/missing-key-id.json","role":"invalid-message-fixture-or-manifest"},{"artifact_status":"draft","digest":"sha256:5cc8b7f6222fc7dfdff676c227d06d45637d1ea2075e937939a64e6e733b9f47","path":"conformance/messages/invalid/missing-verification-material-id.json","role":"invalid-message-fixture-or-manifest"},{"artifact_status":"draft","digest":"sha256:74fdc9e4f54e42ad9200b5c1641ef35ace2d0cba4f1d1f12d996438a45029210","path":"conformance/messages/invalid/nan.json","role":"invalid-message-fixture-or-manifest"},{"artifact_status":"draft","digest":"sha256:e8ea533c4f4a907616bdc8e7cfdb58e11d9a94db02684d075365eaac34f22fe8","path":"conformance/messages/invalid/negative-zero.json","role":"invalid-message-fixture-or-manifest"},{"artifact_status":"draft","digest":"sha256:1312b308af750dbdac5f47026024be4acaf3ab0eaa2600e37f4afd936f4c98fa","path":"conformance/messages/invalid/noncanonical-number.json","role":"invalid-message-fixture-or-manifest"},{"artifact_status":"draft","digest":"sha256:f6e88ca6c0fcddfcfbafc97afd2f03a46ac6943fd33ceaef9bb0cc689a3ed1ec","path":"conformance/messages/invalid/noncanonical-whitespace.json","role":"invalid-message-fixture-or-manifest"},{"artifact_status":"draft","digest":"sha256:bbac4ff24ced7719d372950e83ae741f3d27ca0441f63e02d7cb6663504cadbf","path":"conformance/messages/invalid/party-a-material-for-party-b.json","role":"invalid-message-fixture-or-manifest"},{"artifact_status":"draft","digest":"sha256:5973f6c7ab542396954b7c31b8a649b44b1e60c234953158f0d30327f66e1636","path":"conformance/messages/invalid/party-supplied-commitment-pair-id.json","role":"invalid-message-fixture-or-manifest"},{"artifact_status":"draft","digest":"sha256:fb22a9fde8c0ad7e0bed32fd00628f7ab3395e0cd58b9c0c805a8f20a6b79132","path":"conformance/messages/invalid/payload-digest-mismatch.json","role":"invalid-message-fixture-or-manifest"},{"artifact_status":"draft","digest":"sha256:3b121238340421c8231d54f335acdbdf6cdea10d196de585ff7f3d66656304cc","path":"conformance/messages/invalid/plaintext-decision-in-receipt.json","role":"invalid-message-fixture-or-manifest"},{"artifact_status":"draft","digest":"sha256:e2dc95ebe8d6997b03663797780e0faa86277486f07f51d5fbb5f13ee87334bc","path":"conformance/messages/invalid/prior-transcript-digest-mismatch.json","role":"invalid-message-fixture-or-manifest"},{"artifact_status":"draft","digest":"sha256:1a6a43b5b1a088c3e86ce4abd86b37e4bdf7cec69491e8529633c1a1399696db","path":"conformance/messages/invalid/profile-material-instance-mismatch.json","role":"invalid-message-fixture-or-manifest"},{"artifact_status":"draft","digest":"sha256:d834ff58087cc11302b2bbfb76b81b02e483df02ac5c04278d1cbe41556ce1ee","path":"conformance/messages/invalid/protocol-version-mismatch.json","role":"invalid-message-fixture-or-manifest"},{"artifact_status":"draft","digest":"sha256:d4471095050cb664ffe5bb2f58834bfd7d53b6363339128a661dcf5f0cc3ab7f","path":"conformance/messages/invalid/raw-failure-code-in-party-notice.json","role":"invalid-message-fixture-or-manifest"},{"artifact_status":"draft","digest":"sha256:ab07f2d2707c826b2730d8f62fdb756c649b3462bc2a7d6d5317e6dca9f1c2fa","path":"conformance/messages/invalid/revoked-verification-material.json","role":"invalid-message-fixture-or-manifest"},{"artifact_status":"draft","digest":"sha256:69f413cecd2cc938a7f03420df28e931a24f50089337fedee8e7f9f282e89ec1","path":"conformance/messages/invalid/same-role-other-active-key.json","role":"invalid-message-fixture-or-manifest"},{"artifact_status":"draft","digest":"sha256:4e109eea37f4c215128000bbd12e11fac576de6f8a1988c846d5ba80b830fbab","path":"conformance/messages/invalid/secret-input-in-receipt.json","role":"invalid-message-fixture-or-manifest"},{"artifact_status":"draft","digest":"sha256:21a811e3172756f336310b0e2e7ed2f1f880209414d7aae8e2d01e425fad9482","path":"conformance/messages/invalid/stale-message.json","role":"invalid-message-fixture-or-manifest"},{"artifact_status":"draft","digest":"sha256:c0b11983d8bb472879e6172dafc5a75f4a316d0120656295d22bfabd15d808d4","path":"conformance/messages/invalid/unicode-normalization-substitution.json","role":"invalid-message-fixture-or-manifest"},{"artifact_status":"draft","digest":"sha256:5a42899de638456ebdf2cc11ded300924207e814b37cc918d8aca47884bb5578","path":"conformance/messages/invalid/unknown-authentication-mode.json","role":"invalid-message-fixture-or-manifest"},{"artifact_status":"draft","digest":"sha256:d6b8dc1b1aace81be5f81536965ba1514a460a2fe10862a70a00a6764e740ed0","path":"conformance/messages/invalid/unknown-field.json","role":"invalid-message-fixture-or-manifest"},{"artifact_status":"draft","digest":"sha256:06214e9dfaf5a841a24bfb2f8cf9965fff0f8efb3accff2b8af68db8ee9c679e","path":"conformance/messages/invalid/unknown-message-type.json","role":"invalid-message-fixture-or-manifest"},{"artifact_status"